{
  "id": "wsti",
  "name": "Western Sydney Tech Innovators",
  "shortName": "WSTI",
  "category": "makerspaces",
  "city": "sydney",
  "members": 4036,
  "lat": -33.804,
  "lng": 151.003,
  "who": "Not-for-profit digital inclusion community",
  "what": "AI Project Hub (\"Shed\") · weekly drop-in · prototyping · founder demos",
  "when": "Thu 6pm + Sat 10am (weekly)",
  "where": "Spacecubed, North Parramatta",
  "how": "meetup.com/western-sydney-tech-innovators",
  "url": "https://www.meetup.com/western-sydney-tech-innovators/",
  "why": "Making AI accessible beyond the CBD"
}
