{
  "id": "hsbne",
  "name": "HSBNE (Hackerspace Brisbane)",
  "shortName": "HSBNE",
  "category": "makerspaces",
  "city": "brisbane",
  "members": 1334,
  "lat": -27.567,
  "lng": 152.947,
  "who": "Hackerspace movement — Brisbane chapter",
  "what": "3D printing · electronics · autonomous aircraft · woodshop · digifab · crafting",
  "when": "Tue open night 6:30pm (weekly)",
  "where": "Unit 1, 14 Spine St, Sumner Park",
  "how": "hsbne.org",
  "url": "https://www.meetup.com/en-AU/hackbne/",
  "why": "Making hardware tools and techniques available to all"
}
