{
  "id": "siligong",
  "name": "Siligong Valley",
  "shortName": "Siligong",
  "category": "community",
  "city": "wollongong",
  "members": null,
  "lat": -34.428,
  "lng": 150.893,
  "who": "Grassroots startup founders + entrepreneurs",
  "what": "Startup community · networking · mentoring · events",
  "when": "Regular events",
  "where": "Wollongong / Illawarra",
  "how": "meetup.com/siligongvalley",
  "url": "https://www.meetup.com/en-au/siligongvalley/",
  "why": "Illawarra startup ecosystem"
}
