{
  "id": "bne-oss",
  "name": "Brisbane Open Source Group",
  "shortName": "BNE OSS",
  "category": "opensource",
  "city": "brisbane",
  "members": null,
  "lat": -27.475,
  "lng": 153.025,
  "who": "Open-source enthusiasts",
  "what": "Open-source projects · talks · workshops",
  "when": "Regular meetups",
  "where": "Brisbane",
  "how": "meetup.com (search Brisbane Open Source)",
  "url": "https://www.meetup.com/find/?keywords=open+source&location=au--brisbane",
  "why": "Open-source advocacy in Brisbane"
}
