{
  "id": "lfdt",
  "name": "LFDT Melbourne",
  "shortName": "LFDT Melbourne",
  "category": "decentralised",
  "city": "naarm",
  "members": 558,
  "lat": -37.814,
  "lng": 144.963,
  "who": "LF Decentralized Trust (Linux Foundation)",
  "what": "Blockchain · smart contracts · Hyperledger · tokenisation · ZK systems",
  "when": "Regular online events",
  "where": "Online (Melbourne chapter)",
  "how": "meetup.com/lfdt-melbourne",
  "url": "https://www.meetup.com/lfdt-melbourne/",
  "why": "Open-source distributed trust infrastructure"
}
