{
  "id": "data-science",
  "name": "Data Science Melbourne",
  "shortName": "Data Science",
  "category": "ai",
  "city": "naarm",
  "members": 13926,
  "lat": -37.798,
  "lng": 144.961,
  "who": "Cross-sector data community",
  "what": "Data science talks · predictive modelling · Python · R · SQL",
  "when": "Every ~6 weeks · morning, lunch, and evening options",
  "where": "Various (university-sponsored)",
  "how": "meetup.com/data-science-melbourne",
  "url": "https://www.meetup.com/data-science-melbourne/",
  "why": "Data-driven insights across sectors"
}
