{
  "id": "game-creatives",
  "name": "Melbourne Game Creatives",
  "shortName": "Game Creatives",
  "category": "community",
  "city": "naarm",
  "members": 2089,
  "lat": -37.812,
  "lng": 144.96,
  "who": "Game development community",
  "what": "Indie game dev · Unity · Unreal · design · art · music",
  "when": "Monthly online showcases",
  "where": "Online + Melbourne",
  "how": "gamecreatives.com",
  "url": "https://www.meetup.com/melbourne-game-developers/",
  "why": "Independent game creation"
}
