{
  "id": "adl-tech-mixer",
  "name": "Adelaide Tech Mixer",
  "shortName": "Tech Mixer ADL",
  "category": "community",
  "city": "adelaide",
  "members": null,
  "lat": -34.925,
  "lng": 138.605,
  "who": "Cross-sector tech social",
  "what": "Tech · AI · Data · IT networking and social",
  "when": "Regular events",
  "where": "Adelaide",
  "how": "meetup.com (search Adelaide tech)",
  "url": "https://www.meetup.com/en-AU/find/?keywords=tech&location=au--adelaide",
  "why": "Connecting Adelaide tech people across sectors"
}
