{
  "id": "gc-radio",
  "name": "Gold Coast Amateur Radio Society (VK4)",
  "shortName": "GC Radio",
  "category": "radio",
  "city": "goldcoast",
  "members": null,
  "lat": -28.01,
  "lng": 153.42,
  "who": "Amateur radio club — Gold Coast",
  "what": "Licensing · contests · digital modes · repeater operations",
  "when": "Regular meetings",
  "where": "Gold Coast",
  "how": "wia.org.au/clubs/vk4",
  "url": "https://www.wia.org.au/clubs/vk4/GoldCoastAmateurRadioSociety/",
  "why": "Amateur radio on the Gold Coast"
}
