{
  "id": "ai-ml-robots",
  "name": "AI + ML + Robots",
  "shortName": "AI+ML+Robots",
  "category": "makerspaces",
  "city": "naarm",
  "members": 1085,
  "lat": -37.819,
  "lng": 144.998,
  "who": "Physical computing + ML community",
  "what": "ML meets the real world — autonomous vehicles, physical robotics",
  "when": "Monthly Mon 7pm",
  "where": "Richmond Library, 415 Church St",
  "how": "meetup.com/ai-ml-robots",
  "url": "https://www.meetup.com/ai-ml-robots/",
  "why": "Machine learning that touches physical things"
}
