{
  "id": "maker-community",
  "name": "Maker Community Inc",
  "shortName": "Maker Community",
  "category": "makerspaces",
  "city": "naarm",
  "members": 1410,
  "lat": -37.767,
  "lng": 144.96,
  "who": "Not-for-profit makerspace",
  "what": "Woodworking · CNC · laser · 3D printing · metalwork · electronics · textiles",
  "when": "Mon & Thu evenings · Sat daytime · Tours Mon 7pm",
  "where": "70 Saxon St, Brunswick",
  "how": "makercommunity.org.au",
  "url": "https://makercommunity.org.au",
  "why": "Open-access fabrication for everyone"
}
