{
  "id": "emdrc",
  "name": "EMDRC (VK3ER)",
  "shortName": "EMDRC",
  "category": "radio",
  "city": "naarm",
  "members": null,
  "lat": -37.85,
  "lng": 145.089,
  "who": "Amateur radio club",
  "what": "Repeater ops · licensing courses · contests · digital modes · field days",
  "when": "Sun 10am & Wed 8:30pm on-air · Thu clubrooms + Zoom",
  "where": "13a McCubbin St, Burwood",
  "how": "emdrc.com.au",
  "url": "https://www.emdrc.com.au",
  "why": "Amateur radio experimentation and licensing"
}
